{
  "schema": "beyond-prompting/profile@1",
  "id": "diamond-right",
  "title": "Fixture profile diamond-right",
  "description": "Synthetic fixture: second parent extending the shared ancestor.",
  "controls": [
    {
      "control": "FMR-003",
      "baseline": true
    }
  ],
  "extends": [
    "diamond-base"
  ]
}
