{
  "schema": "beyond-prompting/profile@1",
  "id": "diamond-top",
  "title": "Fixture profile diamond-top",
  "description": "Synthetic fixture: diamond composition of both parents.",
  "controls": [
    {
      "control": "FMR-004",
      "baseline": true
    }
  ],
  "extends": [
    "diamond-left",
    "diamond-right"
  ]
}
