{
  "schema": "beyond-prompting/profile@1",
  "id": "workstation",
  "title": "Local interactive workstation",
  "description": "A single-user interactive Hermes on a personal machine, with no remote exposure and no unattended ingestion of hostile content.",
  "controls": [
    {
      "control": "FMR-002",
      "baseline": true,
      "note": "Redaction is the default even where exposure is minimal."
    },
    {
      "control": "FMR-008",
      "baseline": true,
      "note": "Deprecated reference retained deliberately; resolves to FMR-009."
    },
    {
      "control": "FMR-007",
      "baseline": false,
      "note": "Backup before changes is strong practice; on a purely local experimental install the owner may accept file-level copies."
    },
    {
      "control": "FMR-013",
      "baseline": false
    }
  ]
}
