{
  "schema": "beyond-prompting/profile@1",
  "id": "team-runtime",
  "title": "Multi-profile team runtime",
  "description": "Several profiles and users sharing one host and supervision domain; composes the private-server baseline and adds shared-runtime controls.",
  "extends": [
    "private-server"
  ],
  "controls": [
    {
      "control": "FMR-014",
      "baseline": true
    },
    {
      "control": "FMR-006",
      "baseline": false,
      "note": "Recommended when any member profile ingests untrusted content."
    }
  ]
}
